{
  "device_uid": "esp32-A1B2C3D4E5F6",
  "device_id": "esp32_01",
  "timestamp": 1788307200,
  "ax": 0.04,
  "ay": -0.02,
  "az": 0.98,
  "gx": 5.2,
  "gy": -1.1,
  "gz": 3.6,
  "accel_magnitude": 0.981,
  "gyro_magnitude": 6.42,
  "pitch_deg": -3.1,
  "roll_deg": 2.7,
  "battery_percent_source": "not_configured",
  "detector_mode": "normal",
  "threshold_profile": "normal",
  "sample_interval_ms": 50,
  "telemetry_interval_ms": 2000,
  "fft_enabled": false,
  "wifi_rssi": -58,
  "rssi": -58,
  "sample_seq": 341,
  "sensor_ready": true,
  "sensor_valid": true,
  "sensor_read_ok": true,
  "sensor_sample_age_ms": 18,
  "sensor_failures": 0,
  "i2c_error_count": 0,
  "i2c_recovery_count": 0,
  "i2c_last_error": "none"
}
